{
  "type": "catalog-request",
  "schemaVersion": 1,
  "pairIdHash": "65628a9e671c78cf2dd85ef5e9522f0bac3e6bb33ad4673ba8a4acf7e846b59f",
  "pairEpoch": 1,
  "requestId": "capIdCAPIDcapIdCAPIDcapIdCAPIDcapIdCAPID",
  "requesterDeviceKeyId": "a1b2c3d4e5f6a1b2c3d4e5f6a1b2c3d4e5f6a1b2c3d4e5f6a1b2c3d4e5f6a1b2",
  "ownerEphemeralPublicKey": {
    "kty": "EC",
    "crv": "P-256",
    "x": "ABCDEFGHIJKLMNOPQRSTUVWXYZabcdefghijklmnopA",
    "y": "ZYXWVUTSRQPONMLKJIHGFEDCBAzyxwvutsrqponmlkj"
  },
  "createdAt": 1700002000,
  "expiresAt": 1700002900,
  "signature": "ABCDEFGHIJKLMNOPQRSTUVWXYZabcdefghijklmnopqrstuvwxyz0123456789_-ABCDEFGHIJKLMNOPQRSTUV"
}
